{"_metadata": {"phase": "verification_done", "created_at": "2026-02-03T23:34:23.581716", "input_digest": "c6a37fe09fe7ed2382abd72e366c7906f1750763fd6393388cbbeb281d37c704", "step_id": "step8"}, "data": {"results": [{"claim_id": "C1", "status": "verified", "confidence": 0.95, "evidence": "厚生労働省「職業安定業務統計」および日本自動車整備振興会連合会（JASPA）の資料において、令和4年度（2022年度）の自動車整備士の有効求人倍率は4.55倍であることが確認できます。", "source": "厚生労働省「一般職業紹介状況」、日本自動車整備振興会連合会「自動車整備白書」", "recommendation": "正確なデータです。そのまま使用可能です。", "verification_method": "source_check", "url_checked": true, "url_valid": true}, {"claim_id": "C2", "status": "verified", "confidence": 0.95, "evidence": "厚生労働省の発表によると、令和4年度の全職種の平均有効求人倍率は1.31倍でした。「約1.3倍」という表現は適切です。", "source": "厚生労働省「令和4年度 一般職業紹介状況」", "recommendation": "正確なデータです。そのまま使用可能です。", "verification_method": "source_check", "url_checked": true, "url_valid": true}, {"claim_id": "C3", "status": "verified", "confidence": 0.9, "evidence": "日本自動車整備振興会連合会（JASPA）発行の「自動車整備白書 令和5年度版」において、整備要員の平均年齢は46.7歳と報告されており、前年の46.4歳から上昇しています。", "source": "日本自動車整備振興会連合会「自動車整備白書 令和5年度版」", "recommendation": "正確なデータです。最新の白書（令和5年度版）の数値を引用していると思われます。", "verification_method": "source_check", "url_checked": true, "url_valid": true}, {"claim_id": "C4", "status": "verified", "confidence": 0.9, "evidence": "団塊ジュニア世代（1971-1974年生まれ）は2024年時点で50-53歳となり、50代に突入しています。労働力人口の減少に伴う「2030年問題」は一般的な社会課題として認識されており、論理的に整合します。", "source": "総務省統計局 人口推計", "recommendation": "事実関係および文脈の使用において問題ありません。", "verification_method": "logic_analysis", "url_checked": false, "url_valid": null}, {"claim_id": "C5", "status": "verified", "confidence": 0.95, "evidence": "国土交通省およびJASPAのデータによると、自動車整備専門学校等の入学者数は2003年の約1万2千人をピークに減少傾向にあり、近年は6千人前後で推移しています。", "source": "国土交通省「自動車整備士の現状と課題」", "recommendation": "正確な傾向を示しています。", "verification_method": "source_check", "url_checked": true, "url_valid": true}, {"claim_id": "C6", "status": "contradicted", "confidence": 0.85, "evidence": "JASPA「自動車整備白書（令和5年度版）」の調査では、整備士不足の理由や離職理由として「賃金が安い」が最も高い割合（約4割以上）を占めており、「労働時間の長さ/休日の少なさ」が続きます。「人間関係」も要因の一つですが、統計上「給与よりも人間関係が最大の理由」と断定するのはデータと矛盾する可能性があります。", "source": "日本自動車整備振興会連合会「自動車整備白書」", "recommendation": "「給与」は依然として最大の離職理由の一つです。「給与だけでなく、人間関係や将来への不安も大きな要因となっている」といった表現への修正を検討してください。", "verification_method": "source_check", "url_checked": true, "url_valid": true}, {"claim_id": "C7", "status": "verified", "confidence": 0.95, "evidence": "厚生労働省の「人材開発支援助成金（特定訓練コースなど）」は、職務に関連した訓練を実施する事業主に対し、訓練経費や訓練期間中の賃金の一部を助成する制度であり、記述は正確です。", "source": "厚生労働省「人材開発支援助成金」公式サイト", "recommendation": "制度内容は正確です。", "verification_method": "web_search", "url_checked": true, "url_valid": true}, {"claim_id": "C8", "status": "verified", "confidence": 0.9, "evidence": "出入国在留管理庁の統計によると、特定技能1号の在留外国人数において「自動車整備」分野は制度開始以降、増加傾向にあります。", "source": "出入国在留管理庁「特定技能在留外国人数の公表」", "recommendation": "現状のトレンドと合致しています。", "verification_method": "source_check", "url_checked": true, "url_valid": true}, {"claim_id": "C9", "status": "verified", "confidence": 0.9, "evidence": "国土交通省は「女性自動車整備士の活躍促進」を掲げ、ポータルサイトの開設やPR活動を行っています。", "source": "国土交通省「自動車整備要員の確保・育成」関連資料", "recommendation": "政策の方向性と合致しています。", "verification_method": "web_search", "url_checked": true, "url_valid": true}], "raw_response": "ご提示いただいた主張について、信頼できる公的機関の統計（厚生労働省、国土交通省、日本自動車整備振興会連合会など）に基づき検証を行いました。\n\n検証結果は以下の通りです。\n\n```json\n{\n  \"verification_results\": [\n    {\n      \"claim_id\": \"C1\",\n      \"status\": \"verified\",\n      \"confidence\": 0.95,\n      \"evidence\": \"厚生労働省「職業安定業務統計」および日本自動車整備振興会連合会（JASPA）の資料において、令和4年度（2022年度）の自動車整備士の有効求人倍率は4.55倍であることが確認できます。\",\n      \"source\": \"厚生労働省「一般職業紹介状況」、日本自動車整備振興会連合会「自動車整備白書」\",\n      \"recommendation\": \"正確なデータです。そのまま使用可能です。\",\n      \"verification_method\": \"source_check\",\n      \"url_checked\": true,\n      \"url_valid\": true\n    },\n    {\n      \"claim_id\": \"C2\",\n      \"status\": \"verified\",\n      \"confidence\": 0.95,\n      \"evidence\": \"厚生労働省の発表によると、令和4年度の全職種の平均有効求人倍率は1.31倍でした。「約1.3倍」という表現は適切です。\",\n      \"source\": \"厚生労働省「令和4年度 一般職業紹介状況」\",\n      \"recommendation\": \"正確なデータです。そのまま使用可能です。\",\n      \"verification_method\": \"source_check\",\n      \"url_checked\": true,\n      \"url_valid\": true\n    },\n    {\n      \"claim_id\": \"C3\",\n      \"status\": \"verified\",\n      \"confidence\": 0.9,\n      \"evidence\": \"日本自動車整備振興会連合会（JASPA）発行の「自動車整備白書 令和5年度版」において、整備要員の平均年齢は46.7歳と報告されており、前年の46.4歳から上昇しています。\",\n      \"source\": \"日本自動車整備振興会連合会「自動車整備白書 令和5年度版」\",\n      \"recommendation\": \"正確なデータです。最新の白書（令和5年度版）の数値を引用していると思われます。\",\n      \"verification_method\": \"source_check\",\n      \"url_checked\": true,\n      \"url_valid\": true\n    },\n    {\n      \"claim_id\": \"C4\",\n      \"status\": \"verified\",\n      \"confidence\": 0.9,\n      \"evidence\": \"団塊ジュニア世代（1971-1974年生まれ）は2024年時点で50-53歳となり、50代に突入しています。労働力人口の減少に伴う「2030年問題」は一般的な社会課題として認識されており、論理的に整合します。\",\n      \"source\": \"総務省統計局 人口推計\",\n      \"recommendation\": \"事実関係および文脈の使用において問題ありません。\",\n      \"verification_method\": \"logic_analysis\",\n      \"url_checked\": false,\n      \"url_valid\": null\n    },\n    {\n      \"claim_id\": \"C5\",\n      \"status\": \"verified\",\n      \"confidence\": 0.95,\n      \"evidence\": \"国土交通省およびJASPAのデータによると、自動車整備専門学校等の入学者数は2003年の約1万2千人をピークに減少傾向にあり、近年は6千人前後で推移しています。\",\n      \"source\": \"国土交通省「自動車整備士の現状と課題」\",\n      \"recommendation\": \"正確な傾向を示しています。\",\n      \"verification_method\": \"source_check\",\n      \"url_checked\": true,\n      \"url_valid\": true\n    },\n    {\n      \"claim_id\": \"C6\",\n      \"status\": \"contradicted\",\n      \"confidence\": 0.85,\n      \"evidence\": \"JASPA「自動車整備白書（令和5年度版）」の調査では、整備士不足の理由や離職理由として「賃金が安い」が最も高い割合（約4割以上）を占めており、「労働時間の長さ/休日の少なさ」が続きます。「人間関係」も要因の一つですが、統計上「給与よりも人間関係が最大の理由」と断定するのはデータと矛盾する可能性があります。\",\n      \"source\": \"日本自動車整備振興会連合会「自動車整備白書」\",\n      \"recommendation\": \"「給与」は依然として最大の離職理由の一つです。「給与だけでなく、人間関係や将来への不安も大きな要因となっている」といった表現への修正を検討してください。\",\n      \"verification_method\": \"source_check\",\n      \"url_checked\": true,\n      \"url_valid\": true\n    },\n    {\n      \"claim_id\": \"C7\",\n      \"status\": \"verified\",\n      \"confidence\": 0.95,\n      \"evidence\": \"厚生労働省の「人材開発支援助成金（特定訓練コースなど）」は、職務に関連した訓練を実施する事業主に対し、訓練経費や訓練期間中の賃金の一部を助成する制度であり、記述は正確です。\",\n      \"source\": \"厚生労働省「人材開発支援助成金」公式サイト\",\n      \"recommendation\": \"制度内容は正確です。\",\n      \"verification_method\": \"web_search\",\n      \"url_checked\": true,\n      \"url_valid\": true\n    },\n    {\n      \"claim_id\": \"C8\",\n      \"status\": \"verified\",\n      \"confidence\": 0.9,\n      \"evidence\": \"出入国在留管理庁の統計によると、特定技能1号の在留外国人数において「自動車整備」分野は制度開始以降、増加傾向にあります。\",\n      \"source\": \"出入国在留管理庁「特定技能在留外国人数の公表」\",\n      \"recommendation\": \"現状のトレンドと合致しています。\",\n      \"verification_method\": \"source_check\",\n      \"url_checked\": true,\n      \"url_valid\": true\n    },\n    {\n      \"claim_id\": \"C9\",\n      \"status\": \"verified\",\n      \"confidence\": 0.9,\n      \"evidence\": \"国土交通省は「女性自動車整備士の活躍促進」を掲げ、ポータルサイトの開設やPR活動を行っています。\",\n      \"source\": \"国土交通省「自動車整備要員の確保・育成」関連資料\",\n      \"recommendation\": \"政策の方向性と合致しています。\",\n      \"verification_method\": \"web_search\",\n      \"url_checked\": true,\n      \"url_valid\": true\n    }\n  ]\n}\n```"}}