{
  "step": "step0",
  "keyword": "ドライバー 採用 難しい",
  "analysis": "工程0「キーワード選定・分析」の専門家として、「ドライバー 採用 難しい」というキーワードを分析し、記事制作に向けた戦略を策定します。\n\n```json\n{\n  \"keyword\": \"ドライバー 採用 難しい\",\n  \"search_intent\": \"物流・運送業界の採用担当者が、求人を出しても応募が来ない、あるいは採用しても定着しない現状に直面し、その構造的な原因（市場背景）と具体的な解決策（採用手法、待遇改善、ターゲット変更など）を求めている。Informational（原因理解）とTransactional（解決策模索）の混合意図。\",\n  \"target_audience\": \"中小〜中堅規模の運送・物流会社の経営者または採用担当者。2024年問題や労働人口減少による人手不足に強い危機感を抱いており、従来の求人媒体頼みの手法に限界を感じている層。\",\n  \"four_pillars_evaluation\": {\n    \"neuroscience\": {\n      \"phase\": 1,\n      \"brain_activation\": \"扁桃体\",\n      \"score\": 85,\n      \"rationale\": \"「難しい」というネガティブな感情が出発点であり、事業存続に関わる「恐怖・不安」が扁桃体を強く刺激している状態。この不安に寄り添いつつ、論理的な解決策（前頭前野）へ誘導する構成が極めて有効。\"\n    },\n    \"behavioral_economics\": {\n      \"applicable_principles\": [\n        \"損失回避\",\n        \"社会的証明\",\n        \"希少性\"\n      ],\n      \"score\": 80,\n      \"rationale\": \"「ドライバー不足による倒産リスク・売上機会損失（損失回避）」が最も強い動機付けとなる。また、「他社が実践している成功事例（社会的証明）」や「若手人材の希少性」を訴求することで行動を促せる。\"\n    },\n    \"llmo\": {\n      \"citation_potential\": \"high\",\n      \"score\": 85,\n      \"rationale\": \"「ドライバー採用難の理由」「効果的な採用手法」などはAIが回答を生成する際によく参照されるトピック。有効求人倍率の推移や具体的な対策リストを構造化して提示することで、引用可能性が高まる。\"\n    },\n    \"kgi\": {\n      \"expected_cvr\": 3.5,\n      \"score\": 75,\n      \"rationale\": \"課題が顕在化しており、解決策（採用代行、求人媒体、コンサルティング等）へのニーズが高い。記事で信頼を獲得できれば、問い合わせや資料請求への転換率は比較的高いと予測される。\"\n    }\n  },\n  \"article_strategy\": {\n    \"type\": \"comprehensive_guide\",\n    \"strategy\": \"standard\",\n    \"background\": {\n      \"why_now\": \"物流2024年問題の適用開始により、ドライバー不足が事業継続の致命的なボトルネックとなっているため。\",\n      \"target_pain\": \"求人費をかけても応募ゼロ、面接ドタキャン、若手が採用できない、高齢ドライバーの退職。\",\n      \"key_message\": \"「待ち」の採用は終わり。「選ばれる会社」への変革と、ターゲット別（若手・女性・シニア）の戦略的アプローチが採用難を突破する。\",\n      \"urgency\": \"high\"\n    }\n  },\n  \"recommended_angles\": [\n    {\n      \"angle\": \"市場データに基づく構造的要因の解説と打開策\",\n      \"expected_effect\": \"「なぜ難しいか」を客観的データ（有効求人倍率等）で示し、納得感（Phase 2）醸成と信頼性向上を図る。\",\n      \"differentiation\": \"単なる精神論ではなく、需給ギャップを数値で示し、競合と差別化する具体的なターゲット設定（ペルソナ別訴求）を提案する。\"\n    },\n    {\n      \"angle\": \"採用チャネルの多角化（Indeed、SNS、リファラル）\",\n      \"expected_effect\": \"従来の紙媒体や求人サイト以外の選択肢を提示し、具体的なアクションプランを提供する。\",\n      \"differentiation\": \"各チャネルのドライバー採用におけるメリット・デメリットを比較し、自社に合った手法を選べるようにする。\"\n    },\n    {\n      \"angle\": \"「選ばれる会社」になるための労働環境改善とブランディング\",\n      \"expected_effect\": \"給与・休日・福利厚生の見直しが採用力の根幹であることを伝え、根本治療を促す。\",\n      \"differentiation\": \"中小企業でも可能な「働きやすさ」のアピール方法や、DXによる業務効率化を採用広報に繋げる視点。\"\n    }\n  ],\n  \"content_type_suggestion\": \"市場データを交えた網羅的な解説記事（グラフや図解推奨）\",\n  \"difficulty_score\": 7,\n  \"industry_category\": \"logistics\"\n}\n```",
  "search_intent": "物流・運送業界の採用担当者が、求人を出しても応募が来ない、あるいは採用しても定着しない現状に直面し、その構造的な原因（市場背景）と具体的な解決策（採用手法、待遇改善、ターゲット変更など）を求めている。Informational（原因理解）とTransactional（解決策模索）の混合意図。",
  "difficulty_score": 7,
  "recommended_angles": [
    {
      "angle": "市場データに基づく構造的要因の解説と打開策",
      "expected_effect": "「なぜ難しいか」を客観的データ（有効求人倍率等）で示し、納得感（Phase 2）醸成と信頼性向上を図る。",
      "differentiation": "単なる精神論ではなく、需給ギャップを数値で示し、競合と差別化する具体的なターゲット設定（ペルソナ別訴求）を提案する。"
    },
    {
      "angle": "採用チャネルの多角化（Indeed、SNS、リファラル）",
      "expected_effect": "従来の紙媒体や求人サイト以外の選択肢を提示し、具体的なアクションプランを提供する。",
      "differentiation": "各チャネルのドライバー採用におけるメリット・デメリットを比較し、自社に合った手法を選べるようにする。"
    },
    {
      "angle": "「選ばれる会社」になるための労働環境改善とブランディング",
      "expected_effect": "給与・休日・福利厚生の見直しが採用力の根幹であることを伝え、根本治療を促す。",
      "differentiation": "中小企業でも可能な「働きやすさ」のアピール方法や、DXによる業務効率化を採用広報に繋げる視点。"
    }
  ],
  "target_audience": "中小〜中堅規模の運送・物流会社の経営者または採用担当者。2024年問題や労働人口減少による人手不足に強い危機感を抱いており、従来の求人媒体頼みの手法に限界を感じている層。",
  "content_type_suggestion": "市場データを交えた網羅的な解説記事（グラフや図解推奨）",
  "four_pillars_evaluation": {
    "neuroscience": {
      "phase": 1,
      "brain_activation": "扁桃体",
      "score": 85
    },
    "behavioral_economics": {
      "applicable_principles": [
        "損失回避",
        "社会的証明",
        "希少性"
      ],
      "score": 80
    },
    "llmo": {
      "citation_potential": "high",
      "score": 85
    },
    "kgi": {
      "expected_cvr": 3.5,
      "score": 75
    }
  },
  "article_strategy": {
    "type": "comprehensive_guide",
    "strategy": "standard",
    "background": {
      "why_now": "物流2024年問題の適用開始により、ドライバー不足が事業継続の致命的なボトルネックとなっているため。",
      "target_pain": "求人費をかけても応募ゼロ、面接ドタキャン、若手が採用できない、高齢ドライバーの退職。",
      "key_message": "「待ち」の採用は終わり。「選ばれる会社」への変革と、ターゲット別（若手・女性・シニア）の戦略的アプローチが採用難を突破する。",
      "urgency": "high"
    }
  },
  "word_count_config": {
    "mode": "ai_balanced",
    "manual_word_count": null,
    "tolerance": {
      "min_tolerance": -300,
      "max_tolerance": 300
    }
  },
  "cta_specification": {
    "design_type": "staged",
    "placements": {
      "early": {
        "position": 650,
        "url": "",
        "text": ""
      },
      "mid": {
        "position": 2800,
        "url": "",
        "text": ""
      },
      "final": {
        "position": "target_word_count - 500",
        "url": "",
        "text": ""
      }
    }
  },
  "search_volume": null,
  "competition": null,
  "model": "gemini-3-pro-preview",
  "model_config": {
    "platform": "gemini",
    "model": "gemini-3-pro-preview"
  },
  "token_usage": {
    "input": 1861,
    "output": 1128
  },
  "metrics": {
    "char_count": 2414,
    "word_count": 1143
  },
  "quality": {
    "issues": [],
    "attempts": 1
  },
  "parse_result": {
    "success": true,
    "format_detected": "json",
    "fixes_applied": [
      "code_block_removed"
    ]
  }
}