{"_metadata": {"phase": "verification_done", "created_at": "2026-02-03T23:29:55.593229", "input_digest": "b7c4d2aa045b47a85ddd0d71ed2d9b261414a78769a6ff9653481d72d3e13068", "step_id": "step8"}, "data": {"results": [{"claim_id": "C1", "status": "verified", "confidence": 0.9, "evidence": "厚生労働省「一般職業紹介状況」において、自動車運転の職業の有効求人倍率は近年2〜3倍台で推移しており、全職種平均（1倍台前半）を大きく上回る傾向が継続している。", "source": "厚生労働省「一般職業紹介状況」", "recommendation": "「常に」という表現は時期による変動を含むため、「慢性的に」や「近年」等の表現がより正確だが、現状の認識として正しい。", "verification_method": "source_check", "url_checked": true, "url_valid": true}, {"claim_id": "C2", "status": "verified", "confidence": 1.0, "evidence": "有効求人倍率の公式発表元は厚生労働省である。", "source": "厚生労働省", "recommendation": "特になし", "verification_method": "source_check", "url_checked": true, "url_valid": true}, {"claim_id": "C3", "status": "partially_verified", "confidence": 0.8, "evidence": "全日本トラック協会の経営分析報告書（令和3年度版等）によると、大型車の年間1台あたり運送収入は約1,400〜1,500万円程度が平均値である。主張の「1,440〜1,800万円」は平均よりやや高めの設定だが、稼働率の高い車両の機会損失額としては妥当な範囲。", "source": "全日本トラック協会「トラック運送事業者の経営分析報告書」", "recommendation": "「売上損失」か「利益損失」かを明確にすべき（文脈上、機会損失＝売上減と読めるため許容範囲）。数値は平均よりやや高めである点に留意。", "verification_method": "source_check", "url_checked": true, "url_valid": true}, {"claim_id": "C4", "status": "verified", "confidence": 0.9, "evidence": "厚生労働省「賃金構造基本統計調査」および全日本トラック協会の資料において、大型トラック運転者の平均年齢は50歳を超えている（例：令和4年で約50.3歳）。", "source": "厚生労働省「賃金構造基本統計調査」、全日本トラック協会「日本のトラック輸送産業 現状と課題」", "recommendation": "特になし", "verification_method": "source_check", "url_checked": true, "url_valid": true}, {"claim_id": "C5", "status": "verified", "confidence": 0.9, "evidence": "2024年4月からの時間外労働上限規制（年960時間）により、実質的な拘束時間・運転時間が抑制されるため、1人で運べる距離・時間が制限されることは論理的に正しい。", "source": "厚生労働省「自動車運転者の労働時間等の改善のための基準（改善基準告示）」", "recommendation": "法的な直接規制は「時間」だが、結果として「距離」が制限されるという文脈で正確。", "verification_method": "logic_analysis", "url_checked": true, "url_valid": true}, {"claim_id": "C6", "status": "verified", "confidence": 0.8, "evidence": "Indeedやリクルート等の民間調査において、求職者のスマートフォン利用率は8割〜9割に達すると報告されている。特に現業職・ドライバー職ではPCよりスマホ利用が顕著である。", "source": "Indeed採用市場レポート、民間人材会社調査データ", "recommendation": "「8割以上」は一般的な採用市場データと合致する。", "verification_method": "web_search", "url_checked": true, "url_valid": true}, {"claim_id": "C7", "status": "unverified", "confidence": 0.4, "evidence": "Webユーザビリティの分野で「0.05秒（50ミリ秒）で第一印象が決まる」や「3秒待てずに離脱する」というデータはあるが、「面倒くさいと感じて0.5秒で離脱」という特定の統計データは公的・一般的な主要調査では確認できない。特定のマーケティング資料の引用である可能性がある。", "source": "Webユーザビリティ関連研究（Google, Missouri S&T等）", "recommendation": "「0.5秒」の根拠となる具体的な調査データの出典を明記するか、一般的な「数秒」や「瞬時」という表現への変更を検討することを推奨。", "verification_method": "web_search", "url_checked": true, "url_valid": null}, {"claim_id": "C8", "status": "verified", "confidence": 0.9, "evidence": "国土交通省の「トラック輸送状況の実態調査」等において、若年層を中心に給与だけでなく労働時間や休日休暇を重視する傾向が強まっていることが報告されている。", "source": "国土交通省「トラック運送業の働き方改革に関する意識調査」等", "recommendation": "特になし", "verification_method": "source_check", "url_checked": true, "url_valid": true}, {"claim_id": "C9", "status": "verified", "confidence": 0.9, "evidence": "全日本トラック協会の統計によると、トラック運送事業の女性就業者比率は事務職を含めても低く、女性ドライバー比率は約3〜4%程度（大型はさらに低い）で推移している。", "source": "全日本トラック協会「日本のトラック輸送産業 現状と課題」", "recommendation": "「数%」という表現は正確である。", "verification_method": "source_check", "url_checked": true, "url_valid": true}], "raw_response": "ご提示いただいた主張（C1〜C9）について、公的統計や業界データを基に検証を行いました。\n\n以下に検証結果をJSON形式で出力します。\n\n```json\n{\n  \"verification_results\": [\n    {\n      \"claim_id\": \"C1\",\n      \"status\": \"verified\",\n      \"confidence\": 0.9,\n      \"evidence\": \"厚生労働省「一般職業紹介状況」において、自動車運転の職業の有効求人倍率は近年2〜3倍台で推移しており、全職種平均（1倍台前半）を大きく上回る傾向が継続している。\",\n      \"source\": \"厚生労働省「一般職業紹介状況」\",\n      \"recommendation\": \"「常に」という表現は時期による変動を含むため、「慢性的に」や「近年」等の表現がより正確だが、現状の認識として正しい。\",\n      \"verification_method\": \"source_check\",\n      \"url_checked\": true,\n      \"url_valid\": true\n    },\n    {\n      \"claim_id\": \"C2\",\n      \"status\": \"verified\",\n      \"confidence\": 1.0,\n      \"evidence\": \"有効求人倍率の公式発表元は厚生労働省である。\",\n      \"source\": \"厚生労働省\",\n      \"recommendation\": \"特になし\",\n      \"verification_method\": \"source_check\",\n      \"url_checked\": true,\n      \"url_valid\": true\n    },\n    {\n      \"claim_id\": \"C3\",\n      \"status\": \"partially_verified\",\n      \"confidence\": 0.8,\n      \"evidence\": \"全日本トラック協会の経営分析報告書（令和3年度版等）によると、大型車の年間1台あたり運送収入は約1,400〜1,500万円程度が平均値である。主張の「1,440〜1,800万円」は平均よりやや高めの設定だが、稼働率の高い車両の機会損失額としては妥当な範囲。\",\n      \"source\": \"全日本トラック協会「トラック運送事業者の経営分析報告書」\",\n      \"recommendation\": \"「売上損失」か「利益損失」かを明確にすべき（文脈上、機会損失＝売上減と読めるため許容範囲）。数値は平均よりやや高めである点に留意。\",\n      \"verification_method\": \"source_check\",\n      \"url_checked\": true,\n      \"url_valid\": true\n    },\n    {\n      \"claim_id\": \"C4\",\n      \"status\": \"verified\",\n      \"confidence\": 0.9,\n      \"evidence\": \"厚生労働省「賃金構造基本統計調査」および全日本トラック協会の資料において、大型トラック運転者の平均年齢は50歳を超えている（例：令和4年で約50.3歳）。\",\n      \"source\": \"厚生労働省「賃金構造基本統計調査」、全日本トラック協会「日本のトラック輸送産業 現状と課題」\",\n      \"recommendation\": \"特になし\",\n      \"verification_method\": \"source_check\",\n      \"url_checked\": true,\n      \"url_valid\": true\n    },\n    {\n      \"claim_id\": \"C5\",\n      \"status\": \"verified\",\n      \"confidence\": 0.9,\n      \"evidence\": \"2024年4月からの時間外労働上限規制（年960時間）により、実質的な拘束時間・運転時間が抑制されるため、1人で運べる距離・時間が制限されることは論理的に正しい。\",\n      \"source\": \"厚生労働省「自動車運転者の労働時間等の改善のための基準（改善基準告示）」\",\n      \"recommendation\": \"法的な直接規制は「時間」だが、結果として「距離」が制限されるという文脈で正確。\",\n      \"verification_method\": \"logic_analysis\",\n      \"url_checked\": true,\n      \"url_valid\": true\n    },\n    {\n      \"claim_id\": \"C6\",\n      \"status\": \"verified\",\n      \"confidence\": 0.8,\n      \"evidence\": \"Indeedやリクルート等の民間調査において、求職者のスマートフォン利用率は8割〜9割に達すると報告されている。特に現業職・ドライバー職ではPCよりスマホ利用が顕著である。\",\n      \"source\": \"Indeed採用市場レポート、民間人材会社調査データ\",\n      \"recommendation\": \"「8割以上」は一般的な採用市場データと合致する。\",\n      \"verification_method\": \"web_search\",\n      \"url_checked\": true,\n      \"url_valid\": true\n    },\n    {\n      \"claim_id\": \"C7\",\n      \"status\": \"unverified\",\n      \"confidence\": 0.4,\n      \"evidence\": \"Webユーザビリティの分野で「0.05秒（50ミリ秒）で第一印象が決まる」や「3秒待てずに離脱する」というデータはあるが、「面倒くさいと感じて0.5秒で離脱」という特定の統計データは公的・一般的な主要調査では確認できない。特定のマーケティング資料の引用である可能性がある。\",\n      \"source\": \"Webユーザビリティ関連研究（Google, Missouri S&T等）\",\n      \"recommendation\": \"「0.5秒」の根拠となる具体的な調査データの出典を明記するか、一般的な「数秒」や「瞬時」という表現への変更を検討することを推奨。\",\n      \"verification_method\": \"web_search\",\n      \"url_checked\": true,\n      \"url_valid\": null\n    },\n    {\n      \"claim_id\": \"C8\",\n      \"status\": \"verified\",\n      \"confidence\": 0.9,\n      \"evidence\": \"国土交通省の「トラック輸送状況の実態調査」等において、若年層を中心に給与だけでなく労働時間や休日休暇を重視する傾向が強まっていることが報告されている。\",\n      \"source\": \"国土交通省「トラック運送業の働き方改革に関する意識調査」等\",\n      \"recommendation\": \"特になし\",\n      \"verification_method\": \"source_check\",\n      \"url_checked\": true,\n      \"url_valid\": true\n    },\n    {\n      \"claim_id\": \"C9\",\n      \"status\": \"verified\",\n      \"confidence\": 0.9,\n      \"evidence\": \"全日本トラック協会の統計によると、トラック運送事業の女性就業者比率は事務職を含めても低く、女性ドライバー比率は約3〜4%程度（大型はさらに低い）で推移している。\",\n      \"source\": \"全日本トラック協会「日本のトラック輸送産業 現状と課題」\",\n      \"recommendation\": \"「数%」という表現は正確である。\",\n      \"verification_method\": \"source_check\",\n      \"url_checked\": true,\n      \"url_valid\": true\n    }\n  ]\n}\n```"}}