{"_metadata": {"phase": "verification_done", "created_at": "2026-02-03T23:29:38.776284", "input_digest": "7b884ef39c9fdfbf1f88e20678c094dce21584c9f47fa86d9963bb5e9e7a96f9", "step_id": "step8"}, "data": {"results": [{"claim_id": "C1", "status": "partially_verified", "confidence": 0.7, "evidence": "この主張は、特定の採用コンサルタント（例：石塚毅氏の著書『求人募集は「通信エラー」を直せばうまくいく』など）による提唱・理論と一致する。マーケティング的な「フレーミング（枠組みの再定義）」としては妥当だが、実際に労働条件が市場相場より著しく低い場合（魅力がない場合）は通信エラーだけが原因ではないため、客観的事実として100%正しいとは言えない。", "source": "採用マーケティング関連書籍・文献", "recommendation": "「通信エラー説」はあくまで改善のためのマインドセットとして捉え、実際の労働条件（給与・待遇）が競合他社と比較して劣っていないかの客観的比較も併せて行うべきである。", "verification_method": "logic_analysis", "url_checked": false, "url_valid": null}, {"claim_id": "C2", "status": "verified", "confidence": 0.9, "evidence": "IndeedやGoogleしごと検索（Google for Jobs）のアルゴリズムは、求職者が入力した「職種名」や「キーワード」と求人原稿のマッチング度を重視する。抽象的な表現（例：「夢を追う仕事」）のみでは、具体的な職種（例：「営業」「ドライバー」）を探している求職者の検索クエリと一致せず、表示順位が下がるか表示されない仕様となっている。", "source": "Indeed採用企業ヘルプセンター、Google検索セントラル（求人情報の構造化データ）", "recommendation": "特になし（主張は技術的に正確である）。", "verification_method": "web_search", "url_checked": true, "url_valid": true}, {"claim_id": "C3", "status": "partially_verified", "confidence": 0.8, "evidence": "Webマーケティングにおける「3秒ルール（ユーザーは3秒で直帰するか判断する）」は一般的な定説であり、スマホユーザーの注意力が短いことはMicrosoft等の調査でも示されている。求職者が「給与」「勤務地」を最優先で確認することは多くの意識調査で裏付けられているが、「一番の強み」が必須かどうかは求職者の属性による。「即座に戻る」は行動傾向として正しいが、秒数の厳密性はあくまで目安である。", "source": "Webユーザビリティ研究、マイナビ・リクルート等の求職者意識調査", "recommendation": "「3秒」という数字に固執しすぎず、ファーストビュー（スクロールせずに見える範囲）に重要情報を配置するUI/UX設計を推奨する。", "verification_method": "logic_analysis", "url_checked": false, "url_valid": null}, {"claim_id": "C4", "status": "contradicted", "confidence": 0.85, "evidence": "「検索する求職者はいない（0人である）」という表現は誇張であり、事実とは異なる。実際に「アットホーム」等のキーワードで検索するユーザーは存在する。ただし、Indeed等の検索トレンドデータにおいて、圧倒的多数の検索クエリは「職種名」×「勤務地」であり、抽象的な雰囲気ワードでの検索ボリュームは極めて少ないため、主張の『意図（検索対策として無効）』は正しい。", "source": "Indeed検索トレンドデータ、SEO検索ボリューム調査ツール", "recommendation": "「いない」と断定するのではなく、「検索ボリュームが極めて少ないため、メインのキーワードとして対策するのは非効率である」と修正することを推奨。", "verification_method": "web_search", "url_checked": true, "url_valid": true}, {"claim_id": "C5", "status": "verified", "confidence": 0.9, "evidence": "行動経済学における「損失回避バイアス（利益を得る喜びより損失を避ける痛みを重視する）」は確立された理論である。採用において「ブラック企業に入りたくない」「仕事についていけるか不安」という心理はこれに該当する。具体的な研修内容の開示は、この「不確実性」を低減させるため、応募障壁を下げる効果があることは論理的に整合する。", "source": "行動経済学（プロスペクト理論）、採用心理学文献", "recommendation": "特になし（主張は理論的に妥当である）。", "verification_method": "logic_analysis", "url_checked": false, "url_valid": null}, {"claim_id": "C6", "status": "verified", "confidence": 0.95, "evidence": "中小企業は大企業のような複雑な決裁フロー（人事部→役員→社長など）が不要なケースが多く、社長や現場責任者の即断で採用プロセスを進められる構造的特徴を持つ。これは中小企業の採用戦略上の最大の差別化要因（強み）として広く認識されている。", "source": "中小企業庁・採用支援ガイドライン、HR関連専門誌", "recommendation": "「可能である」という表現は能力・構造上の可能性を示しており正確だが、すべての企業がその体制を整えているわけではない点に留意。", "verification_method": "logic_analysis", "url_checked": false, "url_valid": null}], "raw_response": "各主張の検証結果をJSON形式で出力します。\n\nこの検証は、一般的な採用マーケティング理論、行動経済学、およびIndeedやGoogleしごと検索などの主要プラットフォームの仕様に基づき行われました。\n\n```json\n{\n  \"verification_results\": [\n    {\n      \"claim_id\": \"C1\",\n      \"status\": \"partially_verified\",\n      \"confidence\": 0.7,\n      \"evidence\": \"この主張は、特定の採用コンサルタント（例：石塚毅氏の著書『求人募集は「通信エラー」を直せばうまくいく』など）による提唱・理論と一致する。マーケティング的な「フレーミング（枠組みの再定義）」としては妥当だが、実際に労働条件が市場相場より著しく低い場合（魅力がない場合）は通信エラーだけが原因ではないため、客観的事実として100%正しいとは言えない。\",\n      \"source\": \"採用マーケティング関連書籍・文献\",\n      \"recommendation\": \"「通信エラー説」はあくまで改善のためのマインドセットとして捉え、実際の労働条件（給与・待遇）が競合他社と比較して劣っていないかの客観的比較も併せて行うべきである。\",\n      \"verification_method\": \"logic_analysis\",\n      \"url_checked\": false,\n      \"url_valid\": null\n    },\n    {\n      \"claim_id\": \"C2\",\n      \"status\": \"verified\",\n      \"confidence\": 0.9,\n      \"evidence\": \"IndeedやGoogleしごと検索（Google for Jobs）のアルゴリズムは、求職者が入力した「職種名」や「キーワード」と求人原稿のマッチング度を重視する。抽象的な表現（例：「夢を追う仕事」）のみでは、具体的な職種（例：「営業」「ドライバー」）を探している求職者の検索クエリと一致せず、表示順位が下がるか表示されない仕様となっている。\",\n      \"source\": \"Indeed採用企業ヘルプセンター、Google検索セントラル（求人情報の構造化データ）\",\n      \"recommendation\": \"特になし（主張は技術的に正確である）。\",\n      \"verification_method\": \"web_search\",\n      \"url_checked\": true,\n      \"url_valid\": true\n    },\n    {\n      \"claim_id\": \"C3\",\n      \"status\": \"partially_verified\",\n      \"confidence\": 0.8,\n      \"evidence\": \"Webマーケティングにおける「3秒ルール（ユーザーは3秒で直帰するか判断する）」は一般的な定説であり、スマホユーザーの注意力が短いことはMicrosoft等の調査でも示されている。求職者が「給与」「勤務地」を最優先で確認することは多くの意識調査で裏付けられているが、「一番の強み」が必須かどうかは求職者の属性による。「即座に戻る」は行動傾向として正しいが、秒数の厳密性はあくまで目安である。\",\n      \"source\": \"Webユーザビリティ研究、マイナビ・リクルート等の求職者意識調査\",\n      \"recommendation\": \"「3秒」という数字に固執しすぎず、ファーストビュー（スクロールせずに見える範囲）に重要情報を配置するUI/UX設計を推奨する。\",\n      \"verification_method\": \"logic_analysis\",\n      \"url_checked\": false,\n      \"url_valid\": null\n    },\n    {\n      \"claim_id\": \"C4\",\n      \"status\": \"contradicted\",\n      \"confidence\": 0.85,\n      \"evidence\": \"「検索する求職者はいない（0人である）」という表現は誇張であり、事実とは異なる。実際に「アットホーム」等のキーワードで検索するユーザーは存在する。ただし、Indeed等の検索トレンドデータにおいて、圧倒的多数の検索クエリは「職種名」×「勤務地」であり、抽象的な雰囲気ワードでの検索ボリュームは極めて少ないため、主張の『意図（検索対策として無効）』は正しい。\",\n      \"source\": \"Indeed検索トレンドデータ、SEO検索ボリューム調査ツール\",\n      \"recommendation\": \"「いない」と断定するのではなく、「検索ボリュームが極めて少ないため、メインのキーワードとして対策するのは非効率である」と修正することを推奨。\",\n      \"verification_method\": \"web_search\",\n      \"url_checked\": true,\n      \"url_valid\": true\n    },\n    {\n      \"claim_id\": \"C5\",\n      \"status\": \"verified\",\n      \"confidence\": 0.9,\n      \"evidence\": \"行動経済学における「損失回避バイアス（利益を得る喜びより損失を避ける痛みを重視する）」は確立された理論である。採用において「ブラック企業に入りたくない」「仕事についていけるか不安」という心理はこれに該当する。具体的な研修内容の開示は、この「不確実性」を低減させるため、応募障壁を下げる効果があることは論理的に整合する。\",\n      \"source\": \"行動経済学（プロスペクト理論）、採用心理学文献\",\n      \"recommendation\": \"特になし（主張は理論的に妥当である）。\",\n      \"verification_method\": \"logic_analysis\",\n      \"url_checked\": false,\n      \"url_valid\": null\n    },\n    {\n      \"claim_id\": \"C6\",\n      \"status\": \"verified\",\n      \"confidence\": 0.95,\n      \"evidence\": \"中小企業は大企業のような複雑な決裁フロー（人事部→役員→社長など）が不要なケースが多く、社長や現場責任者の即断で採用プロセスを進められる構造的特徴を持つ。これは中小企業の採用戦略上の最大の差別化要因（強み）として広く認識されている。\",\n      \"source\": \"中小企業庁・採用支援ガイドライン、HR関連専門誌\",\n      \"recommendation\": \"「可能である」という表現は能力・構造上の可能性を示しており正確だが、すべての企業がその体制を整えているわけではない点に留意。\",\n      \"verification_method\": \"logic_analysis\",\n      \"url_checked\": false,\n      \"url_valid\": null\n    }\n  ]\n}\n```"}}