{"_metadata": {"phase": "verification_done", "created_at": "2026-02-04T00:25:34.901491", "input_digest": "f057313548c8403930e324ba3ca50ca11447e4e28d8659788985b6e27ea99e0a", "step_id": "step8"}, "data": {"results": [{"claim_id": "C1", "status": "verified", "confidence": 0.95, "evidence": "厚生労働省「一般職業紹介状況」のデータと整合します。令和5年（2023年）平均の全職種有効求人倍率は約1.31倍、自動車運転の職業は約2.94倍（約3倍）で推移しており、主張の数値は正確です。", "source": "厚生労働省 一般職業紹介状況（令和5年分）", "recommendation": "特になし（正確なデータです）", "verification_method": "source_check", "url_checked": true, "url_valid": true}, {"claim_id": "C2", "status": "verified", "confidence": 0.95, "evidence": "有効求人倍率の公式な出典元は厚生労働省の「一般職業紹介状況」であり、正しい引用です。", "source": "厚生労働省", "recommendation": "特になし", "verification_method": "source_check", "url_checked": true, "url_valid": true}, {"claim_id": "C3", "status": "partially_verified", "confidence": 0.85, "evidence": "高齢化の傾向は正しいですが、数値の厳密性に微差があります。全日本トラック協会「日本のトラック輸送産業 現状と課題（2024）」が引用する厚労省データ（2023年賃金構造基本統計調査）では、大型トラック運転者の平均年齢は「50.7歳」です。「50.9歳」は過去の特定年度（2021年等）や特定区分の数値の可能性がありますが、50歳を超えているという文脈は正しいです。", "source": "全日本トラック協会 / 厚生労働省 賃金構造基本統計調査", "recommendation": "最新データ（50.7歳など）への更新、または「約51歳」「50歳以上」という表現の検討を推奨します。", "verification_method": "source_check", "url_checked": true, "url_valid": true}, {"claim_id": "C4", "status": "verified", "confidence": 0.9, "evidence": "全日本トラック協会の資料等によると、道路貨物運送業における29歳以下の就業者比率は約10%未満（多くの場合6〜9%程度）で推移しており、主張はデータと合致します。", "source": "総務省 労働力調査 / 全日本トラック協会", "recommendation": "特になし", "verification_method": "source_check", "url_checked": true, "url_valid": true}, {"claim_id": "C5", "status": "verified", "confidence": 0.9, "evidence": "全日本トラック協会は厚生労働省や総務省のデータを集約し「日本のトラック輸送産業 現状と課題」等のレポートで年齢構成を公表しており、出典として適切です。", "source": "全日本トラック協会", "recommendation": "特になし", "verification_method": "source_check", "url_checked": true, "url_valid": true}, {"claim_id": "C6", "status": "verified", "confidence": 1.0, "evidence": "働き方改革関連法に基づき、自動車運転の業務に対する時間外労働の上限規制（年960時間）は、猶予期間を経て2024年4月1日から適用されました。", "source": "厚生労働省「自動車運転者の長時間労働改善に向けたポータルサイト」", "recommendation": "特になし", "verification_method": "source_check", "url_checked": true, "url_valid": true}, {"claim_id": "C7", "status": "verified", "confidence": 0.85, "evidence": "Indeed等の求人媒体は、応募後の連絡スピードが採用率に影響するというデータを公表しており、特に「24時間以内の連絡」が推奨されることは採用マーケティングの定説と一致します。", "source": "Indeed Hiring Lab / 人材採用一般データ", "recommendation": "特になし", "verification_method": "web_search", "url_checked": false, "url_valid": null}, {"claim_id": "C8", "status": "verified", "confidence": 0.9, "evidence": "トラック運送業における女性比率は長年低水準で推移しており、全日本トラック協会のデータ等でも約3〜4%（例：3.6%前後）と報告されています。", "source": "総務省 労働力調査 / 全日本トラック協会", "recommendation": "特になし", "verification_method": "source_check", "url_checked": true, "url_valid": true}, {"claim_id": "C9", "status": "verified", "confidence": 0.8, "evidence": "一般的な人事統計においてリファラル採用（紹介）は定着率が高いとされており、特に信頼関係が重視される運送業界でも最も有効な手法の一つとして認識されています。", "source": "HR一般理論 / 運送業界採用ノウハウ", "recommendation": "特になし", "verification_method": "logic_analysis", "url_checked": false, "url_valid": null}, {"claim_id": "C10", "status": "verified", "confidence": 0.9, "evidence": "ブルーカラーやドライバー職の求職活動において、スマートフォン利用率は極めて高く、Indeed等の主要求人サイトのデータでもモバイル経由が8割〜9割を占めることが報告されています。", "source": "求人媒体各社データ", "recommendation": "特になし", "verification_method": "web_search", "url_checked": false, "url_valid": null}, {"claim_id": "C11", "status": "verified", "confidence": 0.85, "evidence": "運送業は労働環境（長時間労働・肉体労働）のイメージギャップ等により、入社直後（早期）の離職率が高い傾向にあることは、厚生労働省の雇用動向調査等でも示唆されています。", "source": "厚生労働省 雇用動向調査", "recommendation": "特になし", "verification_method": "source_check", "url_checked": true, "url_valid": true}], "raw_response": "ご提示いただいた主張について、公的統計（厚生労働省、全日本トラック協会など）や一般的な採用市場データに基づき検証を行いました。\n\n検証結果は以下の通りです。\n\n```json\n{\n  \"verification_results\": [\n    {\n      \"claim_id\": \"C1\",\n      \"status\": \"verified\",\n      \"confidence\": 0.95,\n      \"evidence\": \"厚生労働省「一般職業紹介状況」のデータと整合します。令和5年（2023年）平均の全職種有効求人倍率は約1.31倍、自動車運転の職業は約2.94倍（約3倍）で推移しており、主張の数値は正確です。\",\n      \"source\": \"厚生労働省 一般職業紹介状況（令和5年分）\",\n      \"recommendation\": \"特になし（正確なデータです）\",\n      \"verification_method\": \"source_check\",\n      \"url_checked\": true,\n      \"url_valid\": true\n    },\n    {\n      \"claim_id\": \"C2\",\n      \"status\": \"verified\",\n      \"confidence\": 0.95,\n      \"evidence\": \"有効求人倍率の公式な出典元は厚生労働省の「一般職業紹介状況」であり、正しい引用です。\",\n      \"source\": \"厚生労働省\",\n      \"recommendation\": \"特になし\",\n      \"verification_method\": \"source_check\",\n      \"url_checked\": true,\n      \"url_valid\": true\n    },\n    {\n      \"claim_id\": \"C3\",\n      \"status\": \"partially_verified\",\n      \"confidence\": 0.85,\n      \"evidence\": \"高齢化の傾向は正しいですが、数値の厳密性に微差があります。全日本トラック協会「日本のトラック輸送産業 現状と課題（2024）」が引用する厚労省データ（2023年賃金構造基本統計調査）では、大型トラック運転者の平均年齢は「50.7歳」です。「50.9歳」は過去の特定年度（2021年等）や特定区分の数値の可能性がありますが、50歳を超えているという文脈は正しいです。\",\n      \"source\": \"全日本トラック協会 / 厚生労働省 賃金構造基本統計調査\",\n      \"recommendation\": \"最新データ（50.7歳など）への更新、または「約51歳」「50歳以上」という表現の検討を推奨します。\",\n      \"verification_method\": \"source_check\",\n      \"url_checked\": true,\n      \"url_valid\": true\n    },\n    {\n      \"claim_id\": \"C4\",\n      \"status\": \"verified\",\n      \"confidence\": 0.9,\n      \"evidence\": \"全日本トラック協会の資料等によると、道路貨物運送業における29歳以下の就業者比率は約10%未満（多くの場合6〜9%程度）で推移しており、主張はデータと合致します。\",\n      \"source\": \"総務省 労働力調査 / 全日本トラック協会\",\n      \"recommendation\": \"特になし\",\n      \"verification_method\": \"source_check\",\n      \"url_checked\": true,\n      \"url_valid\": true\n    },\n    {\n      \"claim_id\": \"C5\",\n      \"status\": \"verified\",\n      \"confidence\": 0.9,\n      \"evidence\": \"全日本トラック協会は厚生労働省や総務省のデータを集約し「日本のトラック輸送産業 現状と課題」等のレポートで年齢構成を公表しており、出典として適切です。\",\n      \"source\": \"全日本トラック協会\",\n      \"recommendation\": \"特になし\",\n      \"verification_method\": \"source_check\",\n      \"url_checked\": true,\n      \"url_valid\": true\n    },\n    {\n      \"claim_id\": \"C6\",\n      \"status\": \"verified\",\n      \"confidence\": 1.0,\n      \"evidence\": \"働き方改革関連法に基づき、自動車運転の業務に対する時間外労働の上限規制（年960時間）は、猶予期間を経て2024年4月1日から適用されました。\",\n      \"source\": \"厚生労働省「自動車運転者の長時間労働改善に向けたポータルサイト」\",\n      \"recommendation\": \"特になし\",\n      \"verification_method\": \"source_check\",\n      \"url_checked\": true,\n      \"url_valid\": true\n    },\n    {\n      \"claim_id\": \"C7\",\n      \"status\": \"verified\",\n      \"confidence\": 0.85,\n      \"evidence\": \"Indeed等の求人媒体は、応募後の連絡スピードが採用率に影響するというデータを公表しており、特に「24時間以内の連絡」が推奨されることは採用マーケティングの定説と一致します。\",\n      \"source\": \"Indeed Hiring Lab / 人材採用一般データ\",\n      \"recommendation\": \"特になし\",\n      \"verification_method\": \"web_search\",\n      \"url_checked\": false,\n      \"url_valid\": null\n    },\n    {\n      \"claim_id\": \"C8\",\n      \"status\": \"verified\",\n      \"confidence\": 0.9,\n      \"evidence\": \"トラック運送業における女性比率は長年低水準で推移しており、全日本トラック協会のデータ等でも約3〜4%（例：3.6%前後）と報告されています。\",\n      \"source\": \"総務省 労働力調査 / 全日本トラック協会\",\n      \"recommendation\": \"特になし\",\n      \"verification_method\": \"source_check\",\n      \"url_checked\": true,\n      \"url_valid\": true\n    },\n    {\n      \"claim_id\": \"C9\",\n      \"status\": \"verified\",\n      \"confidence\": 0.8,\n      \"evidence\": \"一般的な人事統計においてリファラル採用（紹介）は定着率が高いとされており、特に信頼関係が重視される運送業界でも最も有効な手法の一つとして認識されています。\",\n      \"source\": \"HR一般理論 / 運送業界採用ノウハウ\",\n      \"recommendation\": \"特になし\",\n      \"verification_method\": \"logic_analysis\",\n      \"url_checked\": false,\n      \"url_valid\": null\n    },\n    {\n      \"claim_id\": \"C10\",\n      \"status\": \"verified\",\n      \"confidence\": 0.9,\n      \"evidence\": \"ブルーカラーやドライバー職の求職活動において、スマートフォン利用率は極めて高く、Indeed等の主要求人サイトのデータでもモバイル経由が8割〜9割を占めることが報告されています。\",\n      \"source\": \"求人媒体各社データ\",\n      \"recommendation\": \"特になし\",\n      \"verification_method\": \"web_search\",\n      \"url_checked\": false,\n      \"url_valid\": null\n    },\n    {\n      \"claim_id\": \"C11\",\n      \"status\": \"verified\",\n      \"confidence\": 0.85,\n      \"evidence\": \"運送業は労働環境（長時間労働・肉体労働）のイメージギャップ等により、入社直後（早期）の離職率が高い傾向にあることは、厚生労働省の雇用動向調査等でも示唆されています。\",\n      \"source\": \"厚生労働省 雇用動向調査\",\n      \"recommendation\": \"特になし\",\n      \"verification_method\": \"source_check\",\n      \"url_checked\": true,\n      \"url_valid\": true\n    }\n  ]\n}\n```"}}