{"_metadata": {"phase": "verification_done", "created_at": "2026-02-04T04:04:50.920382", "input_digest": "f69f82f616bc8b0bed75f6f9c2b5e26409fc233daa2377c24d07f2e2e4aa92cc", "step_id": "step8"}, "data": {"results": [{"claim_id": "C1", "status": "verified", "confidence": 0.9, "evidence": "厚生労働省の「一般職業紹介状況」によると、自動車運転の職業の有効求人倍率は近年2倍〜3倍前後で推移しており、全職種平均（約1.2〜1.3倍）と比較して著しく高い。2023年〜2024年のデータでも「貨物自動車運転手」は2倍台後半〜3倍近くを記録している。", "source": "厚生労働省「一般職業紹介状況（職業安定業務統計）」", "recommendation": "特になし（正確なデータに基づいている）", "verification_method": "source_check", "url_checked": true, "url_valid": true}, {"claim_id": "C2", "status": "verified", "confidence": 0.9, "evidence": "Indeedやリクルートなどの主要求人メディアの調査において、求職者のスマートフォン利用率は80%〜90%近くに達しているとのデータが多数存在する。特にブルーカラー職種ではモバイル利用率が高い傾向にある。", "source": "Indeed採用市場レポート、厚生労働省「労働市場分析レポート」等", "recommendation": "特になし", "verification_method": "web_search", "url_checked": false, "url_valid": null}, {"claim_id": "C3", "status": "verified", "confidence": 0.8, "evidence": "「3秒ルール」は求人広告やWebマーケティング業界における定説（ヒューリスティック）として広く引用されている。科学的な厳密な秒数ではないが、Indeed等のプラットフォームにおいてユーザーが一覧画面をスクロールする速度から、一瞬で判断されるという文脈は正しい。", "source": "人材採用マーケティング文献、Indeed採用ガイド", "recommendation": "「3秒程度」や「一瞬」という表現でも可だが、業界の定説として許容範囲。", "verification_method": "logic_analysis", "url_checked": false, "url_valid": null}, {"claim_id": "C4", "status": "verified", "confidence": 1.0, "evidence": "働き方改革関連法により、2024年4月1日から自動車運転業務に対して時間外労働の上限規制（年960時間）が適用されたことは事実である。", "source": "厚生労働省「自動車運転者の長時間労働改善に向けたポータルサイト」", "recommendation": "特になし", "verification_method": "source_check", "url_checked": true, "url_valid": true}, {"claim_id": "C5", "status": "verified", "confidence": 0.9, "evidence": "男女雇用機会均等法第5条により、募集・採用における性別を理由とする差別は禁止されている。「男性ドライバー活躍中」という表記は、事実の記載であっても「男性を優先している」と受け取られる可能性が高く、厚生労働省のガイドラインやIndeed等の掲載規定で「性別を限定・示唆する表現」としてNGとされるケースが一般的である。", "source": "厚生労働省「男女雇用機会均等法のあらまし」、Indeed求人掲載ガイドライン", "recommendation": "「男女ともに活躍中」や、性別に触れず職場の雰囲気を伝える表現への変更を推奨。", "verification_method": "source_check", "url_checked": true, "url_valid": true}, {"claim_id": "C6", "status": "partially_verified", "confidence": 0.7, "evidence": "雇用対策法により年齢制限は原則禁止であり、例外事由（3号のイなど）を用いる場合は「理由」と「年齢」の明記が必要である点は正しい。しかし、「若手歓迎」という表現自体は「若手」の定義が曖昧であり、年齢差別を示唆する不適切な表現として多くの求人媒体でNGワード扱いとなる。法的に正当な年齢制限を行う場合は「35歳未満（長期勤続によるキャリア形成のため）」のように具体的な数値を用いる必要がある。", "source": "厚生労働省「募集・採用における年齢制限禁止について」", "recommendation": "「若手歓迎」という曖昧な表現ではなく、例外事由に該当する場合は「具体的な年齢上限」と「法的な理由」を併記するよう修正を推奨。", "verification_method": "source_check", "url_checked": true, "url_valid": true}, {"claim_id": "C7", "status": "verified", "confidence": 1.0, "evidence": "最低賃金法において、固定残業代（みなし残業代）は最低賃金の計算基礎に含まれない。したがって、基本給（固定残業代を除いた金額）を所定労働時間で割った金額が最低賃金を下回っている場合は違法となる。", "source": "厚生労働省「最低賃金制度の概要」、労働基準法", "recommendation": "特になし", "verification_method": "logic_analysis", "url_checked": true, "url_valid": true}, {"claim_id": "C8", "status": "verified", "confidence": 0.9, "evidence": "Indeedの「求人掲載ガイドライン」では、職種名に記号（★、！など）や装飾的な表現を含めることを推奨しておらず、スパム判定や検索品質の低下により表示順位が下がる、あるいは掲載不可となるリスクがあることを明記している。", "source": "Indeed「求人掲載に関するポリシー」「職種名の記載ガイドライン」", "recommendation": "職種名はシンプルに業務内容のみ（例：4tトラックドライバー）とするよう推奨。", "verification_method": "source_check", "url_checked": true, "url_valid": true}], "raw_response": "ファクトチェックの専門家として、提供された主張を検証しました。\n以下に検証結果を出力します。\n\n```json\n{\n  \"verification_results\": [\n    {\n      \"claim_id\": \"C1\",\n      \"status\": \"verified\",\n      \"confidence\": 0.9,\n      \"evidence\": \"厚生労働省の「一般職業紹介状況」によると、自動車運転の職業の有効求人倍率は近年2倍〜3倍前後で推移しており、全職種平均（約1.2〜1.3倍）と比較して著しく高い。2023年〜2024年のデータでも「貨物自動車運転手」は2倍台後半〜3倍近くを記録している。\",\n      \"source\": \"厚生労働省「一般職業紹介状況（職業安定業務統計）」\",\n      \"recommendation\": \"特になし（正確なデータに基づいている）\",\n      \"verification_method\": \"source_check\",\n      \"url_checked\": true,\n      \"url_valid\": true\n    },\n    {\n      \"claim_id\": \"C2\",\n      \"status\": \"verified\",\n      \"confidence\": 0.9,\n      \"evidence\": \"Indeedやリクルートなどの主要求人メディアの調査において、求職者のスマートフォン利用率は80%〜90%近くに達しているとのデータが多数存在する。特にブルーカラー職種ではモバイル利用率が高い傾向にある。\",\n      \"source\": \"Indeed採用市場レポート、厚生労働省「労働市場分析レポート」等\",\n      \"recommendation\": \"特になし\",\n      \"verification_method\": \"web_search\",\n      \"url_checked\": false,\n      \"url_valid\": null\n    },\n    {\n      \"claim_id\": \"C3\",\n      \"status\": \"verified\",\n      \"confidence\": 0.8,\n      \"evidence\": \"「3秒ルール」は求人広告やWebマーケティング業界における定説（ヒューリスティック）として広く引用されている。科学的な厳密な秒数ではないが、Indeed等のプラットフォームにおいてユーザーが一覧画面をスクロールする速度から、一瞬で判断されるという文脈は正しい。\",\n      \"source\": \"人材採用マーケティング文献、Indeed採用ガイド\",\n      \"recommendation\": \"「3秒程度」や「一瞬」という表現でも可だが、業界の定説として許容範囲。\",\n      \"verification_method\": \"logic_analysis\",\n      \"url_checked\": false,\n      \"url_valid\": null\n    },\n    {\n      \"claim_id\": \"C4\",\n      \"status\": \"verified\",\n      \"confidence\": 1.0,\n      \"evidence\": \"働き方改革関連法により、2024年4月1日から自動車運転業務に対して時間外労働の上限規制（年960時間）が適用されたことは事実である。\",\n      \"source\": \"厚生労働省「自動車運転者の長時間労働改善に向けたポータルサイト」\",\n      \"recommendation\": \"特になし\",\n      \"verification_method\": \"source_check\",\n      \"url_checked\": true,\n      \"url_valid\": true\n    },\n    {\n      \"claim_id\": \"C5\",\n      \"status\": \"verified\",\n      \"confidence\": 0.9,\n      \"evidence\": \"男女雇用機会均等法第5条により、募集・採用における性別を理由とする差別は禁止されている。「男性ドライバー活躍中」という表記は、事実の記載であっても「男性を優先している」と受け取られる可能性が高く、厚生労働省のガイドラインやIndeed等の掲載規定で「性別を限定・示唆する表現」としてNGとされるケースが一般的である。\",\n      \"source\": \"厚生労働省「男女雇用機会均等法のあらまし」、Indeed求人掲載ガイドライン\",\n      \"recommendation\": \"「男女ともに活躍中」や、性別に触れず職場の雰囲気を伝える表現への変更を推奨。\",\n      \"verification_method\": \"source_check\",\n      \"url_checked\": true,\n      \"url_valid\": true\n    },\n    {\n      \"claim_id\": \"C6\",\n      \"status\": \"partially_verified\",\n      \"confidence\": 0.7,\n      \"evidence\": \"雇用対策法により年齢制限は原則禁止であり、例外事由（3号のイなど）を用いる場合は「理由」と「年齢」の明記が必要である点は正しい。しかし、「若手歓迎」という表現自体は「若手」の定義が曖昧であり、年齢差別を示唆する不適切な表現として多くの求人媒体でNGワード扱いとなる。法的に正当な年齢制限を行う場合は「35歳未満（長期勤続によるキャリア形成のため）」のように具体的な数値を用いる必要がある。\",\n      \"source\": \"厚生労働省「募集・採用における年齢制限禁止について」\",\n      \"recommendation\": \"「若手歓迎」という曖昧な表現ではなく、例外事由に該当する場合は「具体的な年齢上限」と「法的な理由」を併記するよう修正を推奨。\",\n      \"verification_method\": \"source_check\",\n      \"url_checked\": true,\n      \"url_valid\": true\n    },\n    {\n      \"claim_id\": \"C7\",\n      \"status\": \"verified\",\n      \"confidence\": 1.0,\n      \"evidence\": \"最低賃金法において、固定残業代（みなし残業代）は最低賃金の計算基礎に含まれない。したがって、基本給（固定残業代を除いた金額）を所定労働時間で割った金額が最低賃金を下回っている場合は違法となる。\",\n      \"source\": \"厚生労働省「最低賃金制度の概要」、労働基準法\",\n      \"recommendation\": \"特になし\",\n      \"verification_method\": \"logic_analysis\",\n      \"url_checked\": true,\n      \"url_valid\": true\n    },\n    {\n      \"claim_id\": \"C8\",\n      \"status\": \"verified\",\n      \"confidence\": 0.9,\n      \"evidence\": \"Indeedの「求人掲載ガイドライン」では、職種名に記号（★、！など）や装飾的な表現を含めることを推奨しておらず、スパム判定や検索品質の低下により表示順位が下がる、あるいは掲載不可となるリスクがあることを明記している。\",\n      \"source\": \"Indeed「求人掲載に関するポリシー」「職種名の記載ガイドライン」\",\n      \"recommendation\": \"職種名はシンプルに業務内容のみ（例：4tトラックドライバー）とするよう推奨。\",\n      \"verification_method\": \"source_check\",\n      \"url_checked\": true,\n      \"url_valid\": true\n    }\n  ]\n}\n```"}}