{
  "step": "step3_5",
  "keyword": "営業採用難しい",
  "emotional_analysis": {
    "primary_emotion": "焦燥感（採用目標未達によるプレッシャーと、打開策が見えない苛立ち）",
    "secondary_emotions": [
      "徒労感（時間とコストをかけても成果が出ない疲れ）",
      "孤独感（現場からの「まだ採れないのか」という無言の圧力）",
      "不安（このままでは事業成長のボトルネックになってしまうという責任の重さ）"
    ],
    "pain_points": [
      "面接確約後の連絡不通（ドタキャン）による精神的ダメージ",
      "「即戦力が欲しい」という現場の要望と「給与が出せない」という経営の板挟み",
      "求人媒体の管理画面を開くたびに「応募数0」の文字を見るストレス"
    ],
    "desires": [
      "「なぜ採用できないのか」を論理的に説明し、社内の納得と協力を得たい",
      "無駄な工数を減らし、本当に自社に合う人材とだけ向き合いたい",
      "「採用担当のおかげで良い人が入った」と現場から感謝されたい"
    ]
  },
  "human_touch_patterns": [
    {
      "type": "experience",
      "content": "月曜日の朝、期待を込めて求人媒体の管理画面を開いた瞬間の、あの「新着応募0件」の文字を見たときの落胆。あるいは、最終面接まで進んだ有望な候補者から、メール一本で「他社に内定が決まりました」と告げられたときの、力が抜けるような感覚。",
      "placement_suggestion": "記事冒頭（導入部）の「現状への共感」セクション"
    },
    {
      "type": "emotion",
      "content": "営業部門からは「とにかく足で稼げるタフな人材を」と急かされ、経営陣からは「採用コストは抑えろ」と釘を刺される。採用担当者の皆さんは、まるで「無理難題」という名のパズルを、ピースが足りない状態で解かされているような気分ではないでしょうか。",
      "placement_suggestion": "「営業採用が難しい理由」の解説に入る直前"
    },
    {
      "type": "empathy",
      "content": "断言します。採用がうまくいかないのは、あなたの努力不足ではありません。市場の構造が劇的に変化している中で、従来の「待ちの採用」という武器だけで戦うのは、あまりに分が悪い戦いなのです。",
      "placement_suggestion": "市場データの提示後、解決策（ノウハウ）へ移行するつなぎ部分"
    }
  ],
  "experience_episodes": [
    {
      "scenario": "面接ドタキャンと歩留まりの悪化",
      "narrative": "「ぜひ御社で働きたいです！」と目を輝かせていた候補者。しかし面接当日、時間になっても現れず、電話も繋がらない。準備していた会議室で一人、時計の針を見つめる15分間は、業務時間以上の『心の消耗』をもたらします。",
      "lesson": "候補者の熱意を信じすぎず、選考プロセスそのものに「辞退させない仕組み（動機付け）」を組み込む重要性。"
    },
    {
      "scenario": "現場マネージャーとのミスマッチ",
      "narrative": "苦労して連れてきた未経験の若手候補者。「素直で良い子だけど、営業としてのハングリー精神が足りないな」という現場マネージャーの一言で不採用に。市場にはもう『ハングリーな即戦力』なんて、ほとんど残っていないのに……。",
      "lesson": "採用基準の『市場相場とのズレ』を補正し、現場を巻き込んでペルソナを再定義する必要性。"
    }
  ],
  "emotional_hooks": [
    "「また営業部に謝らなければならないのか」……その胃が痛くなるようなプレッシャーを、今日で終わりにしませんか？",
    "採用活動は『孤独な戦い』になりがちです。しかし、データという武器を持てば、それは『経営を動かす説得材料』に変わります。",
    "欲しいのは応募数という『数字』ではなく、一緒に会社の未来を作ってくれる『仲間』のはずです。"
  ],
  "phase_emotional_map": {
    "phase1": {
      "dominant_emotion": "",
      "empathy_statements": [],
      "experience_episodes": []
    },
    "phase2": {
      "dominant_emotion": "",
      "empathy_statements": [],
      "experience_episodes": []
    },
    "phase3": {
      "dominant_emotion": "",
      "empathy_statements": [],
      "experience_episodes": []
    }
  },
  "behavioral_economics_hooks": {
    "loss_aversion_hook": "",
    "social_proof_hook": "",
    "authority_hook": "",
    "scarcity_hook": ""
  },
  "placement_instructions": [],
  "raw_output": "指定されたJSON形式で、キーワード「営業採用難しい」に関する記事に人間味（ヒューマンタッチ）を加えるための要素を出力します。\n\n```json\n{\n  \"emotional_analysis\": {\n    \"primary_emotion\": \"焦燥感（採用目標未達によるプレッシャーと、打開策が見えない苛立ち）\",\n    \"secondary_emotions\": [\n      \"徒労感（時間とコストをかけても成果が出ない疲れ）\",\n      \"孤独感（現場からの「まだ採れないのか」という無言の圧力）\",\n      \"不安（このままでは事業成長のボトルネックになってしまうという責任の重さ）\"\n    ],\n    \"pain_points\": [\n      \"面接確約後の連絡不通（ドタキャン）による精神的ダメージ\",\n      \"「即戦力が欲しい」という現場の要望と「給与が出せない」という経営の板挟み\",\n      \"求人媒体の管理画面を開くたびに「応募数0」の文字を見るストレス\"\n    ],\n    \"desires\": [\n      \"「なぜ採用できないのか」を論理的に説明し、社内の納得と協力を得たい\",\n      \"無駄な工数を減らし、本当に自社に合う人材とだけ向き合いたい\",\n      \"「採用担当のおかげで良い人が入った」と現場から感謝されたい\"\n    ]\n  },\n  \"human_touch_patterns\": [\n    {\n      \"type\": \"experience\",\n      \"content\": \"月曜日の朝、期待を込めて求人媒体の管理画面を開いた瞬間の、あの「新着応募0件」の文字を見たときの落胆。あるいは、最終面接まで進んだ有望な候補者から、メール一本で「他社に内定が決まりました」と告げられたときの、力が抜けるような感覚。\",\n      \"placement_suggestion\": \"記事冒頭（導入部）の「現状への共感」セクション\"\n    },\n    {\n      \"type\": \"emotion\",\n      \"content\": \"営業部門からは「とにかく足で稼げるタフな人材を」と急かされ、経営陣からは「採用コストは抑えろ」と釘を刺される。採用担当者の皆さんは、まるで「無理難題」という名のパズルを、ピースが足りない状態で解かされているような気分ではないでしょうか。\",\n      \"placement_suggestion\": \"「営業採用が難しい理由」の解説に入る直前\"\n    },\n    {\n      \"type\": \"empathy\",\n      \"content\": \"断言します。採用がうまくいかないのは、あなたの努力不足ではありません。市場の構造が劇的に変化している中で、従来の「待ちの採用」という武器だけで戦うのは、あまりに分が悪い戦いなのです。\",\n      \"placement_suggestion\": \"市場データの提示後、解決策（ノウハウ）へ移行するつなぎ部分\"\n    }\n  ],\n  \"experience_episodes\": [\n    {\n      \"scenario\": \"面接ドタキャンと歩留まりの悪化\",\n      \"narrative\": \"「ぜひ御社で働きたいです！」と目を輝かせていた候補者。しかし面接当日、時間になっても現れず、電話も繋がらない。準備していた会議室で一人、時計の針を見つめる15分間は、業務時間以上の『心の消耗』をもたらします。\",\n      \"lesson\": \"候補者の熱意を信じすぎず、選考プロセスそのものに「辞退させない仕組み（動機付け）」を組み込む重要性。\"\n    },\n    {\n      \"scenario\": \"現場マネージャーとのミスマッチ\",\n      \"narrative\": \"苦労して連れてきた未経験の若手候補者。「素直で良い子だけど、営業としてのハングリー精神が足りないな」という現場マネージャーの一言で不採用に。市場にはもう『ハングリーな即戦力』なんて、ほとんど残っていないのに……。\",\n      \"lesson\": \"採用基準の『市場相場とのズレ』を補正し、現場を巻き込んでペルソナを再定義する必要性。\"\n    }\n  ],\n  \"emotional_hooks\": [\n    \"「また営業部に謝らなければならないのか」……その胃が痛くなるようなプレッシャーを、今日で終わりにしませんか？\",\n    \"採用活動は『孤独な戦い』になりがちです。しかし、データという武器を持てば、それは『経営を動かす説得材料』に変わります。\",\n    \"欲しいのは応募数という『数字』ではなく、一緒に会社の未来を作ってくれる『仲間』のはずです。\"\n  ]\n}\n```",
  "parsed_data": {
    "emotional_analysis": {
      "primary_emotion": "焦燥感（採用目標未達によるプレッシャーと、打開策が見えない苛立ち）",
      "secondary_emotions": [
        "徒労感（時間とコストをかけても成果が出ない疲れ）",
        "孤独感（現場からの「まだ採れないのか」という無言の圧力）",
        "不安（このままでは事業成長のボトルネックになってしまうという責任の重さ）"
      ],
      "pain_points": [
        "面接確約後の連絡不通（ドタキャン）による精神的ダメージ",
        "「即戦力が欲しい」という現場の要望と「給与が出せない」という経営の板挟み",
        "求人媒体の管理画面を開くたびに「応募数0」の文字を見るストレス"
      ],
      "desires": [
        "「なぜ採用できないのか」を論理的に説明し、社内の納得と協力を得たい",
        "無駄な工数を減らし、本当に自社に合う人材とだけ向き合いたい",
        "「採用担当のおかげで良い人が入った」と現場から感謝されたい"
      ]
    },
    "human_touch_patterns": [
      {
        "type": "experience",
        "content": "月曜日の朝、期待を込めて求人媒体の管理画面を開いた瞬間の、あの「新着応募0件」の文字を見たときの落胆。あるいは、最終面接まで進んだ有望な候補者から、メール一本で「他社に内定が決まりました」と告げられたときの、力が抜けるような感覚。",
        "placement_suggestion": "記事冒頭（導入部）の「現状への共感」セクション"
      },
      {
        "type": "emotion",
        "content": "営業部門からは「とにかく足で稼げるタフな人材を」と急かされ、経営陣からは「採用コストは抑えろ」と釘を刺される。採用担当者の皆さんは、まるで「無理難題」という名のパズルを、ピースが足りない状態で解かされているような気分ではないでしょうか。",
        "placement_suggestion": "「営業採用が難しい理由」の解説に入る直前"
      },
      {
        "type": "empathy",
        "content": "断言します。採用がうまくいかないのは、あなたの努力不足ではありません。市場の構造が劇的に変化している中で、従来の「待ちの採用」という武器だけで戦うのは、あまりに分が悪い戦いなのです。",
        "placement_suggestion": "市場データの提示後、解決策（ノウハウ）へ移行するつなぎ部分"
      }
    ],
    "experience_episodes": [
      {
        "scenario": "面接ドタキャンと歩留まりの悪化",
        "narrative": "「ぜひ御社で働きたいです！」と目を輝かせていた候補者。しかし面接当日、時間になっても現れず、電話も繋がらない。準備していた会議室で一人、時計の針を見つめる15分間は、業務時間以上の『心の消耗』をもたらします。",
        "lesson": "候補者の熱意を信じすぎず、選考プロセスそのものに「辞退させない仕組み（動機付け）」を組み込む重要性。"
      },
      {
        "scenario": "現場マネージャーとのミスマッチ",
        "narrative": "苦労して連れてきた未経験の若手候補者。「素直で良い子だけど、営業としてのハングリー精神が足りないな」という現場マネージャーの一言で不採用に。市場にはもう『ハングリーな即戦力』なんて、ほとんど残っていないのに……。",
        "lesson": "採用基準の『市場相場とのズレ』を補正し、現場を巻き込んでペルソナを再定義する必要性。"
      }
    ],
    "emotional_hooks": [
      "「また営業部に謝らなければならないのか」……その胃が痛くなるようなプレッシャーを、今日で終わりにしませんか？",
      "採用活動は『孤独な戦い』になりがちです。しかし、データという武器を持てば、それは『経営を動かす説得材料』に変わります。",
      "欲しいのは応募数という『数字』ではなく、一緒に会社の未来を作ってくれる『仲間』のはずです。"
    ]
  },
  "metadata": {
    "generated_at": "2026-02-03T23:20:57.213997",
    "model": "gemini-3-pro-preview",
    "model_config": {
      "platform": "gemini",
      "model": "gemini-3-pro-preview"
    },
    "input_files": [
      "step0",
      "step1",
      "step3a",
      "step3b",
      "step3c",
      "step1_5"
    ]
  },
  "quality": {
    "attempts": 1,
    "issues": []
  },
  "token_usage": {
    "input": 17923,
    "output": 1040
  },
  "output_path": "storage/dev-tenant-001/736be378-e6ef-4450-afa8-be57caf8d1bc/step3_5/output.json",
  "output_digest": "019d20b586303c33"
}